Word,Meaning (Vietnamese),IPA,Example
travel,đi du lịch,/ˈtrævəl/,I love to travel to new countries.
trip,chuyến đi,/trɪp/,We went on a short trip to the beach.
vacation,kỳ nghỉ,/veɪˈkeɪʃn/,I’m planning my summer vacation.
journey,hành trình,/ˈdʒɜːrni/,The journey took more than 10 hours.
tourist,khách du lịch,/ˈtʊrɪst/,Many tourists visit Ha Long Bay every year.
guide,hướng dẫn viên,/ɡaɪd/,The tour guide showed us around the city.
hotel,khách sạn,/hoʊˈtel/,We stayed at a beautiful hotel.
flight,chuyến bay,/flaɪt/,Our flight was delayed for two hours.
luggage,hành lý,/ˈlʌɡɪdʒ/,Don’t forget to pack your luggage.
passport,hộ chiếu,/ˈpæspɔːrt/,You must show your passport at the airport.
ticket,vé,/ˈtɪkɪt/,I bought a ticket for the train to Hue.
destination,điểm đến,/ˌdestɪˈneɪʃn/,Paris is my dream destination.
sightseeing,tham quan,/ˈsaɪtsiːɪŋ/,We went sightseeing around the old town.
beach,bãi biển,/biːtʃ/,Let’s go to the beach and relax.
souvenir,quà lưu niệm,/ˌsuːvəˈnɪr/,I bought some souvenirs for my friends.
map,bản đồ,/mæp/,The map helped us find our way.
backpack,ba lô,/ˈbækpæk/,He carried all his things in a backpack.
camera,máy ảnh,/ˈkæmrə/,Don’t forget to bring your camera.
cruise,chuyến du thuyền,/kruːz/,We took a cruise around the islands.
explore,khám phá,/ɪkˈsplɔːr/,We love to explore new places together.
